;Basisthema;Type;Definitie;Eenheid;Ratio;Teller;Noemer;Bron;Laatste jaar beschikbaar;Aanlevering volgende update;Title;Download URL;Vraagstelling survey
0;Armoede;Geregistreerde statistiek;"Aandeel fiscale aangiften (zonder nulaangiften) met een netto belastbaar inkomen boven 50.000 euro.
Het totale netto belastbaar inkomen bestaat uit alle netto inkomsten van alle inwoners min de aftrekbare uitgaven. Het netto belastbaar inkomen is de som van alle inkomsten uit onroerende goederen (huuropbrengsten en inkomsten uit woningen), inkomsten uit en opbrengsten van roerende goederen en kapitalen (dividenden, intresten…), beroepsinkomsten (wedden en lonen, ziekte-uitkeringen, werkloosheidsuitkeringen, (brug-)pensioenuitkeringen, winsten, baten, wedden van bedrijfsleiders en meewerkende echtgenoten, na aftrek van de beroepskosten) en diverse inkomsten, verminderd met de aftrekbare uitgaven (zoals kinderopvang, onderhoudsuitkeringen, giften…). Deze gegevens zijn gebaseerd op de aangiften in de personenbelasting die door de FOD Financiën aan Statbel worden aangeleverd. Het vermelde jaar is het inkomstenjaar, het jaar dus waarin de gegevens in de aangiften zijn ""verdiend"".";aangifte;procent;Aantal fiscale aangiften (zonder nulaangiften) met een netto belastbaar inkomen hoger dan 50.000 euro;Aantal fiscale aangiften (zonder nulaangiften);Statbel;2020;augustus 2023;Aangiften groter dan 50.000 euro;https://gsminfo.blob.core.windows.net/$web/Rapporten_outputs/OutputPerlDO/GSM_Extract_AR_09.xlsx;
1;Armoede;Burgerbevraging;Aandeel van de inwoners dat behoort tot een huishouden met betalingsmoeilijkheden dat het afgelopen jaar problemen heeft gehad om één of meerdere rekeningen (op tijd) te betalen (huishuur/afbetaling woning, energiekosten, gezondheidskosten, schoolkosten, internet/telefonie/televisie, ...).;persoon;procent;In de teller werden diegenen opgenomen die antwoordden met 'Ja, het is al eens voorgekomen dat de rekening niet (op tijd) kon betaald worden'.;Iedereen die antwoordde op de vraag werd in de noemer opgenomen, uitgezonderd de respondenten die voor alle items in de categorie 'Weet niet/niet van toepassing' zitten. Indien dit om een omvangrijke categorie gaat, wordt hun percentage meegegeven bij 'Opmerkingen bij de kwaliteit'.;Burgerbevraging Gemeente-Stadsmonitor, Agentschap Binnenlands Bestuur;2020;voorjaar 2024;Betalingsmoeilijkheden;https://gsminfo.blob.core.windows.net/$web/Rapporten_outputs/OutputPerlDO/GSM_Extract_AR_S_01.xlsx;Is het gedurende het afgelopen jaar voorgekomen dat jij of een andere persoon van het gezin één of meerdere rekeningen niet (op tijd) kon betalen om financiële redenen? Huishuur/afbetaling woning (terugbetaling lening). Rekening van elektriciteit/water/gas/stookolie. Internet/telefonie/televisie. Gezondheidsuitgaven. Terugbetaling van aankopen op afbetaling (uitgezonderd voor de woning). Schoolkosten. Kinderopvang. Andere kosten. Antwoordmogelijkheden: ‘Neen, dat is het voorbije jaar niet voorgekomen’, ‘Ja, het is al eens voorgekomen dat de rekening niet (op tijd) kon betaald worden’, ‘Weet niet/niet van toepassing’
2;Armoede;Geregistreerde statistiek;Aantal ingeschakelde (actieve) budgetmeters elektriciteit en aardgas ten opzichte van aantal toegangspunten op 31 december.;budgetmeter;per 1.000 toegangspunten;Aantal actieve budgetmeters elektriciteit en aardgas;Aantal toegangspunten elektricteit en aardgas;Vlaamse Regulator van de Elektriciteits- en Gasmarkt;2022;juni 2024;Energie-armoede huishoudens;https://gsminfo.blob.core.windows.net/$web/Rapporten_outputs/OutputPerlDO/GSM_Extract_AR_02.xlsx;
3;Armoede;Geregistreerde statistiek;"Aandeel individuele fiscale aangiften (zonder nulaangiften) met een netto belastbaar inkomen lager dan 10.000 euro.
Aandeel gemeenschappelijke aangiften (zonder nulaangiften) met een netto belastbaar inkomen lager dan 20.000 euro.
Het totale netto belastbaar inkomen bestaat uit alle netto inkomsten van alle inwoners min de aftrekbare uitgaven. Het netto belastbaar inkomen is de som van alle inkomsten uit onroerende goederen (huuropbrengsten en inkomsten uit woningen), inkomsten uit en opbrengsten van roerende goederen en kapitalen (dividenden, intresten…), beroepsinkomsten (wedden en lonen, ziekte-uitkeringen, werkloosheidsuitkeringen, (brug-)pensioenuitkeringen, winsten, baten, wedden van bedrijfsleiders en meewerkende echtgenoten, na aftrek van de beroepskosten) en diverse inkomsten, verminderd met de aftrekbare uitgaven (zoals kinderopvang, onderhoudsuitkeringen, giften…). Deze gegevens zijn gebaseerd op de aangiften in de personenbelasting die door de FOD Financiën aan Statbel worden aangeleverd. Het vermelde jaar is het inkomstenjaar, het jaar dus waarin de gegevens in de aangiften zijn ""verdiend"".";aangifte;procent;"Aantal individuele fiscale aangiften (zonder nulaangiften) met een netto belastbaar inkomen lager dan 10.000 euro
Aantal gemeenschappelijke aangiften (zonder nulaangiften) met een netto belastbaar inkomen lager dan 20.000 euro";Aantal individuele fiscale aangiften (zonder nulaangiften) en aantal gemeenschappelijke aangiften (zonder nulaangiften);Statbel;2020;november 2023;Fiscaal inkomen beneden kritische grens;https://gsminfo.blob.core.windows.net/$web/Rapporten_outputs/OutputPerlDO/GSM_Extract_AR_10.xlsx;
4;Armoede;Geregistreerde statistiek;"Gemiddeld netto belastbaar inkomen per aangifte.
Het totale netto belastbaar inkomen bestaat uit alle netto inkomsten van alle inwoners min de aftrekbare uitgaven. Het netto belastbaar inkomen is de som van alle inkomsten uit onroerende goederen (huuropbrengsten en inkomsten uit woningen), inkomsten uit en opbrengsten van roerende goederen en kapitalen (dividenden, intresten…), beroepsinkomsten (wedden en lonen, ziekte-uitkeringen, werkloosheidsuitkeringen, (brug-)pensioenuitkeringen, winsten, baten, wedden van bedrijfsleiders en meewerkende echtgenoten, na aftrek van de beroepskosten) en diverse inkomsten, verminderd met de aftrekbare uitgaven (zoals kinderopvang, onderhoudsuitkeringen, giften…). Deze gegevens zijn gebaseerd op de aangiften in de personenbelasting die door de FOD Financiën aan Statbel worden aangeleverd. Het vermelde jaar is het inkomstenjaar, het jaar dus waarin de gegevens in de aangiften zijn ""verdiend"".";euro;per aangifte;Totaal netto belastbaar inkomen;Aantal fiscale aangiften (zonder nulaangiften);Statbel;2020;november 2023;Gemiddeld inkomen, per aangifte;https://gsminfo.blob.core.windows.net/$web/Rapporten_outputs/OutputPerlDO/GSM_Extract_AR_12.xlsx;
5;Armoede;Geregistreerde statistiek;"Gemiddeld netto belastbaar inkomen per inwoner.
Het totale netto belastbaar inkomen bestaat uit alle netto inkomsten van alle inwoners min de aftrekbare uitgaven. Het netto belastbaar inkomen is de som van alle inkomsten uit onroerende goederen (huuropbrengsten en inkomsten uit woningen), inkomsten uit en opbrengsten van roerende goederen en kapitalen (dividenden, intresten…), beroepsinkomsten (wedden en lonen, ziekte-uitkeringen, werkloosheidsuitkeringen, (brug-)pensioenuitkeringen, winsten, baten, wedden van bedrijfsleiders en meewerkende echtgenoten, na aftrek van de beroepskosten) en diverse inkomsten, verminderd met de aftrekbare uitgaven (zoals kinderopvang, onderhoudsuitkeringen, giften…). Deze gegevens zijn gebaseerd op de aangiften in de personenbelasting die door de FOD Financiën aan Statbel worden aangeleverd. Het vermelde jaar is het inkomstenjaar, het jaar dus waarin de gegevens in de aangiften zijn ""verdiend"".";euro;per inwoner;Totaal netto belastbaar inkomen;Aantal inwoners;Statbel;2020;november 2023;Gemiddeld inkomen, per inwoner;https://gsminfo.blob.core.windows.net/$web/Rapporten_outputs/OutputPerlDO/GSM_Extract_AR_11.xlsx;
6;Armoede;Geregistreerde statistiek;"Aantal kinderen geboren in een kansarm gezin volgens de criteria van Kind en Gezin in jaar x, jaar x-1 en jaar x-2 en die wonen in de gebiedsomschrijving op 31 december van jaar x ten opzichte van het totaal aantal kinderen geboren in die 3 jaar en die wonen in de gebiedsomschrijving op 31 december van jaar x.
Een gezin wordt door Kind en Gezin als kansarm beschouwd als het op minstens 3 van volgende criteria zwak scoort: beschikbaar maandinkomen, opleiding ouders, arbeidssituatie ouders, laag stimulatieniveau, huisvesting en gezondheid.";persoon;procent;Aantal kinderen geboren in een kansarm gezin volgens de criteria van Kind en Gezin in jaar x, jaar x-1 en jaar x-2 en die wonen in de gebiedsomschrijving op 31 december van jaar x;Aantal kinderen geboren in jaar x, jaar x-1 en jaar x-2 en die wonen in de gebiedsomschrijving op 31 december van jaar x;Kind & Gezin;2021;augustus 2023;Kansarmoede-index Kind en Gezin;https://gsminfo.blob.core.windows.net/$web/Rapporten_outputs/OutputPerlDO/GSM_Extract_AR_03.xlsx;
7;Armoede;Geregistreerde statistiek;Aandeel kinderen van 0 tot en met 17 jaar dat leeft in een gezin waarvan de werkintensiteit lager of gelijk is aan 0,2, op 1 januari van het jaar. De Kruispuntbank van de Sociale Zekerheid (KSZ) registreert de socio-economische positie van de gehele Belgische bevolking. Op huishoudniveau kan worden gekeken hoeveel volwassenen in het gezin aan het werk zijn en in welk arbeidsregime. Op basis daarvan wordt een werkintensiteit van het gezin berekend. Deze werkintensiteit varieert tussen 0 (geen enkel volwassen lid van het gezin werkt) tot 1 (alle volwassen leden van het gezin werken voltijds). De gezinnen met een werkintensiteit lager dan 0,2 worden beschouwd als gezinnen met een zeer lage werkintensiteit.;persoon;procent;Aantal kinderen van 0 tot en met 17 jaar dat leeft in een gezin met zeer lage werkintensiteit;Aantal inwoners van 0 tot en met 17 jaar (KSZ-cijfers);Datawarehouse Arbeidsmarkt en Sociale Bescherming van de Kruispuntbank van de Sociale Zekerheid;2020;augustus 2023;Kinderen in gezin met zeer lage werkintensiteit;https://gsminfo.blob.core.windows.net/$web/Rapporten_outputs/OutputPerlDO/GSM_Extract_AR_08.xlsx;
8;Armoede;Geregistreerde statistiek;"Aantal van de vier leerlingenkenmerken (Thuistaal niet-Nederlands, Laag opleidingsniveau van de moeder, Ontvangen van een schooltoelage, Wonend in een buurt met hoge mate van schoolse vertraging) waaraan de leerlingen van het gewoon lager onderwijs voldoen (""aantikken""), gesommeerd over alle leerlingen van het gewoon lager onderwijs, en vervolgens gedeeld door het totaal aantal leerlingen van het gewoon lager onderwijs, telkens naar woonplaats. De OKI is bijgevolg een cijfer tussen 0 en 4.";kenmerk;per leerling;Aantal van de vier leerlingenkenmerken waaraan de leerlingen van het gewoon lager onderwijs voldoen (thuistaal niet NL, laag opleidingsniveau moeder, ontvangen schooltoeslag, buurtindicator), gesommeerd over alle leerlingen van het gewoon lager onderwijs, naar woonplaats;Aantal leerlingen van het gewoon lager onderwijs, naar woonplaats;Departement Onderwijs & Vorming;2022;februari 2024;Onderwijskansarmoede-indicator (OKI);https://gsminfo.blob.core.windows.net/$web/Rapporten_outputs/OutputPerlDO/GSM_Extract_AR_05.xlsx;
9;Armoede;Geregistreerde statistiek;Aandeel personen van 0 tot en met 59 jaar dat leeft in een gezin waarvan de werkintensiteit lager of gelijk is aan 0,2, op 1 januari van het jaar. De Kruispuntbank van de Sociale Zekerheid (KSZ) registreert de socio-economische positie van de gehele Belgische bevolking. Op huishoudniveau kan worden gekeken hoeveel volwassenen in het gezin aan het werk zijn en in welk arbeidsregime. Op basis daarvan wordt een werkintensiteit van het gezin berekend. Deze werkintensiteit varieert tussen 0 (geen enkel volwassen lid van het gezin werkt) tot 1 (alle volwassen leden van het gezin werken voltijds). De gezinnen met een werkintensiteit lager dan 0,2 worden beschouwd als gezinnen met een zeer lage werkintensiteit.;persoon;procent;Aantal personen van 0 tot en met 59 jaar dat leeft in een gezin met zeer lage werkintensiteit;Aantal inwoners van 0 tot en met 59 jaar (KSZ-cijfers);Datawarehouse Arbeidsmarkt en Sociale Bescherming van de Kruispuntbank van de Sociale Zekerheid;2020;juni 2023;Personen in gezin met zeer lage werkintensiteit;https://gsminfo.blob.core.windows.net/$web/Rapporten_outputs/OutputPerlDO/GSM_Extract_AR_06.xlsx;
10;Armoede;Geregistreerde statistiek;Aantal personen met een leefloon of equivalent leefloon ten opzichte van de totale bevolking, begin van het jaar. Het leefloon kadert in het Recht op Maatschappelijke Integratie (RMI), het equivalent leefloon in het Recht op Maatschappelijke Hulp (RMH). Het RMH is er voor mensen die niet in aanmerking komen voor het RMI maar die zich in een vergelijkbare noodsituatie bevinden. Het (equivalent) leefloon is een minimuminkomen voor personen die niet over voldoende bestaansmiddelen beschikken. Het bedrag van het (equivalent) leefloon hangt af van de woonsituatie. Er bestaan in dit verband drie categorieën: personen die alleen wonen, personen die samenwonen en personen met een gezin ten laste met minstens één minderjarig kind. Het bedrag van het leefloon wordt verminderd met de inkomsten waarover de aanvrager zelf kan beschikken.;persoon;procent;Aantal personen met een (equivalent) leefloon;Aantal inwoners;Programmatorische Overheidsdienst Maatschappelijke Integratie;2022;september 2023;Personen met (equivalent) leefloon;https://gsminfo.blob.core.windows.net/$web/Rapporten_outputs/OutputPerlDO/GSM_Extract_AR_13.xlsx;
11;Armoede;Geregistreerde statistiek;Aantal personen dat op 31 december van het jaar bij de Centrale voor Kredieten aan Particulieren van de Nationale Bank van België geregistreerd staat met minstens één wanbetaling voor een consumentenkrediet (verrichtingen op afbetaling en kredietopeningen) of hypothecair krediet, afgesloten door natuurlijke personen voor privédoeleinden, ten opzichte van de bevolking van 18 jaar en ouder op 1 januari van jaar x+1.;persoon;procent;Aantal personen geregistreerd bij de Centrale voor Kredieten aan Particulieren van de Nationale Bank van België met een betalingsachterstand;Aantal inwoners van 18 jaar en ouder;Nationale Bank van België;2022;februari 2024;Personen met betalingsachterstand;https://gsminfo.blob.core.windows.net/$web/Rapporten_outputs/OutputPerlDO/GSM_Extract_AR_01.xlsx;
12;Armoede;Geregistreerde statistiek;Aantal personen met een Inkomensgarantie voor Ouderen (IGO) of Gewaarborgd Inkomen voor Bejaarden (GIB) ten opzichte van de bevolking van 65 jaar en ouder, begin van het jaar. De IGO/GIB is een minimuminkomen voor ouderen die niet over voldoende bestaansmiddelen beschikken. Het GIB wordt sinds 2002 geleidelijk aan vervangen door de IGO. Meestal gaat het om een toeslag bovenop het pensioen, zodat men een bedrag bekomt dat vergelijkbaar is met het leefloon. Het wordt toegekend aan personen die de pensioengerechtigde leeftijd hebben bereikt maar die door omstandigheden geen of geen voldoende loopbaan hebben kunnen opbouwen.;persoon;procent;Aantal personen met een IGO of GIB;Aantal inwoners van 65 jaar en ouder;Federale Overheidsdienst Sociale Zekerheid;2022;september 2023;Personen met Inkomensgarantie voor Ouderen;https://gsminfo.blob.core.windows.net/$web/Rapporten_outputs/OutputPerlDO/GSM_Extract_AR_15.xlsx;
13;Armoede;Geregistreerde statistiek;Aandeel personen met een inkomensvervangende tegemoetkoming (IVT) of een integratie­tegemoetkoming (IT). Personen met een handicap kunnen een beroep doen op een inkomensvervangende tegemoetkoming (IVT) indien zij door hun handicap geen of minder mogelijkheden hebben om een betaalde baan uit te oefenen. Daarnaast bestaat er voor hen ook een integratie­tegemoetkoming (IT) indien zij moeilijkheden hebben bij het uitvoeren van hun dagelijkse activiteiten. De cijfers over IVT en IT zijn gebaseerd op gegevens van de DG Handicap van de FOD Sociale Zekerheid en hebben betrekking op de situatie op 1 januari van het jaar.;persoon;procent;Aantal personen met een inkomensvervangende tegemoetkoming voor personen met een handicap;Aantal inwoners;Directie-Generaal Personen met een Handicap van FOD Sociale Zekerheid;2021;september 2023;Personen met inkomensvervangende tegemoetkoming;https://gsminfo.blob.core.windows.net/$web/Rapporten_outputs/OutputPerlDO/GSM_Extract_AR_18.xlsx;
14;Armoede;Geregistreerde statistiek;"De federale overheid probeert via de sociale bijstandsuitkeringen de armoedesituatie van de minst gegoede inwoners te verbeteren. Het gaat om: (1) het leefloon en het equivalent leefloon, (2) de inkomensgarantie voor ouderen (IGO) die het vroegere gewaarborgd inkomen voor bejaarden (GIB) vervangt, (3) de inkomensvervangende tegemoetkoming voor personen met een handicap (IVT).
De cijfers over de bevolking met sociale bijstandsuitkering worden berekend door het totaal aantal personen met een (equivalent) leefloon, IGO, GIB, IVT en/of IT af te zetten ten opzichte van het totale aantal inwoners op 1 januari van het jaar.";persoon;procent;Aantal personen met een (equivalent) leefloon, met een IGO of GIB, met een IVT en/of met een IT;Aantal inwoners;Programmatorische Overheidsdienst Maatschappelijke Integratie, Federale Pensioendienst en Directie-Generaal Personen met een Handicap van FOD Sociale Zekerheid;2022;september 2023;Personen met sociale bijstandsuitkering;https://gsminfo.blob.core.windows.net/$web/Rapporten_outputs/OutputPerlDO/GSM_Extract_AR_17.xlsx;
15;Armoede;Geregistreerde statistiek;"Aantal personen met een verhoogde tegemoetkoming in de ziekteverzekering ten opzichte van de totale bevolking, op 1 januari van het jaar. Personen met een verhoogde tegemoetkoming in de ziekteverzekering genieten onder andere van hogere terugbetalingen voor geneeskundige verzorging en geneesmiddelen, een gunstiger stelsel voor de vooruitbetalingen en het persoonlijk aandeel (remgeld) in geval van hospitalisatie.
Er zijn drie rechtgevende categorieën: (1) op basis van een ontvangen sociaal voordeel (leefloon of gelijkaardige OCMW-hulp, IGO, GIB of recht op rentebijslag, uitkering voor personen met een handicap volgens de wet van 27 februari 1987, niet-begeleide minderjarige vreemdelingen, gehandicapte kinderen met ongeschiktheid van ten minste 66%), (2) op basis van een specifieke hoedanigheid en een inkomenscontrole (wezen, gepensioneerden, invaliden, weduwen/weduwnaars, personen die minstens één jaar werkloos of arbeidsongeschikt zijn, personen met een erkende handicap die geen tegemoetkoming ontvangen en leden van eenoudergezinnen), (3) op basis van een inkomenscontrole voor de gezinnen die zich niet in één van bovenstaande situaties bevinden maar leven in een gezin met een bescheiden inkomen (OMNIO-statuut).";persoon;procent;Aantal personen met een verhoogde tegemoetkoming;Aantal inwoners;Datawarehouse Arbeidsmarkt en Sociale Bescherming van de Kruispuntbank van de Sociale Zekerheid;2023;augustus 2024;Personen met verhoogde tegemoetkoming in ziekteverzekering;https://gsminfo.blob.core.windows.net/$web/Rapporten_outputs/OutputPerlDO/GSM_Extract_AR_16.xlsx;
16;Armoede;Burgerbevraging;Aandeel van de inwoners dat (heel erg) moeilijk rondkomt met het maandelijks beschikbare inkomen.;persoon;procent;De tellers werden berekend op basis van 4 antwoordcategorieën: ‘Heel erg moeilijk’, ‘Moeilijk’, ‘Het lukt om rond te komen’ en 'Het lukt om comfortabel te leven'. De indicator is het aandeel van de inwoners die aangeven 'Heel erg moeilijk/Moeilijk' rond te komen.;Iedereen die antwoordde op de vraag werd in de noemer opgenomen, uitgezonderd de respondenten in de categorie 'Weet niet'. Indien dit om een omvangrijke categorie gaat, wordt hun percentage meegegeven bij 'Opmerkingen bij de kwaliteit'.;Burgerbevraging Gemeente-Stadsmonitor, Agentschap Binnenlands Bestuur;2020;voorjaar 2024;Subjectieve armoede;https://gsminfo.blob.core.windows.net/$web/Rapporten_outputs/OutputPerlDO/GSM_Extract_AR_S_02.xlsx;"Kan je met het totale beschikbare inkomen van je gezin, zoals het nu is, maandelijks rondkomen? Het totale beschikbare inkomen van het gezin per maand bestaat uit: netto inkomens uit arbeid of bedrijfsinkomen; sociale uitkeringen (vervangingsinkomen, kinderbijslag, werkloosheidsuitkering, pensioenuitkering, tegemoetkoming personen met handicap); bijkomende uitkeringen (maaltijdcheques, intresten, inkomsten uit mandaten,..). Antwoordmogelijkheden: ‘Heel erg moeilijk’, ‘Moeilijk’, ‘Het lukt om rond te komen met het huidige inkomen’, ‘Het lukt om comfortabel te leven met het huidige inkomen’, 'Weet niet’"
17;Cultuur en vrije tijd;Geregistreerde statistiek;Aantal amateurkunstenorganisaties per 10.000 inwoners.;organisatie;per 10.000 inwoners;Aantal amateurkunstenorgansaties;Aantal inwoners;Sisca;2017;voorjaar 2023;Amateurkunstenorganisaties;https://gsminfo.blob.core.windows.net/$web/Rapporten_outputs/OutputPerlDO/GSM_Extract_CU_01.xlsx;
18;Cultuur en vrije tijd;Burgerbevraging;Aandeel van de inwoners dat het afgelopen jaar minstens één keer een (zomer)festival, een plein- of parkevenement of een fuif heeft bezocht in de eigen gemeente/stad of in een andere gemeente/stad.;persoon;procent;De tellers werden berekend op basis van 3 antwoordcategorieën: 'Nooit/niet aanwezig in mijn gemeente', 'Tot 12 keer (in 2020 samenvoeging van '1 tot 6 keer' en '7 tot 12 keer')', 'Meer dan 12 keer'. De categorie 'Niet aanwezig in mijn gemeente' kon hier niet apart in beeld gebracht worden: zie 'Opmerkingen bij de kwaliteit'.;Iedereen die antwoordde op de vraag werd in de noemer opgenomen.;Burgerbevraging Gemeente-Stadsmonitor, Agentschap Binnenlands Bestuur;2020;voorjaar 2024;Bezoek festival, evenement, fuif in eigen of andere gemeente;https://gsminfo.blob.core.windows.net/$web/Rapporten_outputs/OutputPerlDO/GSM_Extract_CU_S_01.xlsx;"Hoeveel keer ging je het afgelopen jaar in jouw gemeente/stad naar ... een (zomer)festival, een pleinevenement, parkevenement, fuif? Antwoordmogelijkheden: 'Niet aanwezig in mijn gemeente/stad', 'Nooit', '1 tot 6 keer', '7 tot 12 keer', 'Meer dan 12 keer'. 
Hoeveel keer deed je het afgelopen jaar één van de volgende activiteiten in een andere stad of gemeente? Noteer enkel de gemeente waar je het meest bent geweest. Een (zomer)festival, plein- of parkevenement of fuif bijwonen. Antwoordmogelijkheden: 'Nooit', '1 tot 6 keer', '7 tot 12 keer', 'Meer dan 12 keer'. 'In welke andere stad of gemeente deed je dit meestal?'"
19;Cultuur en vrije tijd;Burgerbevraging;Aandeel van de inwoners dat het afgelopen jaar minstens één keer een museum, tentoonstelling, galerij of historisch gebouw heeft bezocht in de eigen gemeente/stad of in een andere gemeente/stad.;persoon;procent;De tellers werden berekend op basis van 3 antwoordcategorieën: 'Nooit', 'Tot 12 keer (in 2020 samenvoeging van '1 tot 6 keer' en '7 tot 12 keer')', 'Meer dan 12 keer'. Daarnaast wordt ook de categorie 'Niet aanwezig in mijn gemeente/stad' in beeld gebracht.;Iedereen die antwoordde op de vraag werd in de noemer opgenomen.;Burgerbevraging Gemeente-Stadsmonitor, Agentschap Binnenlands Bestuur;2020;voorjaar 2024;Bezoek museum, tentoonstelling in eigen of andere gemeente;https://gsminfo.blob.core.windows.net/$web/Rapporten_outputs/OutputPerlDO/GSM_Extract_CU_S_02.xlsx;"Hoeveel keer bezocht je het afgelopen jaar in jouw gemeente/stad ... een museum, tentoonstelling, galerij of historisch gebouw (kasteel, kerk, ...)? Antwoordmogelijkheden: 'Niet aanwezig in mijn gemeente/stad', 'Nooit', '1 tot 6 keer', '7 tot 12 keer', 'Meer dan 12 keer'.
Hoeveel keer deed je het afgelopen jaar één van de volgende activiteiten in een andere stad of gemeente? Noteer enkel de gemeente waar je het meest bent geweest. Een museum, tentoonstelling, galerij of historisch gebouw (kasteel, kerk, ...) bezoeken. Antwoordmogelijkheden: 'Nooit', '1 tot 6 keer', '7 tot 12 keer', 'Meer dan 12 keer'. 'In welke andere stad of gemeente deed je dit meestal?'"
20;Cultuur en vrije tijd;Burgerbevraging;Aandeel van de inwoners dat het afgelopen jaar minstens één keer een restaurant, brasserie of eetcafé heeft bezocht in de eigen gemeente/stad of in een andere gemeente/stad.;persoon;procent;De tellers werden berekend op basis van 3 antwoordcategorieën: 'Nooit', 'Tot 12 keer (in 2020 samenvoeging van '1 tot 6 keer' en '7 tot 12 keer')', 'Meer dan 12 keer'. Daarnaast wordt ook de categorie 'Niet aanwezig in mijn gemeente/stad' in beeld gebracht.;Iedereen die antwoordde op de vraag werd in de noemer opgenomen.;Burgerbevraging Gemeente-Stadsmonitor, Agentschap Binnenlands Bestuur;2020;voorjaar 2024;Bezoek restaurant, brasserie, eetcafé in eigen of andere gemeente;https://gsminfo.blob.core.windows.net/$web/Rapporten_outputs/OutputPerlDO/GSM_Extract_CU_S_15.xlsx;Hoeveel keer bezocht je het afgelopen jaar in jouw gemeente/stad ... een restaurant, brasserie, eetcafé? Antwoordmogelijkheden: 'Niet aanwezig in mijn gemeente/stad', 'Nooit', '1 tot 6 keer', '7 tot 12 keer', 'Meer dan 12 keer'. Hoeveel keer deed je het afgelopen jaar één van de volgende activiteiten in een andere stad of gemeente? Noteer enkel de gemeente waar je het meest bent geweest. Een restaurant, brasserie of eetcafé bezoeken. Antwoordmogelijkheden: 'Nooit', '1 tot 6 keer', '7 tot 12 keer', 'Meer dan 12 keer'. 'In welke andere stad of gemeente deed je dit meestal?'
