;Basisthema;Type;Definitie;Eenheid;Ratio;Teller;Noemer;Bron;Laatste jaar beschikbaar;Aanlevering volgende update;Title;Download URL;Vraagstelling survey
340;Zorg en gezondheid;Burgerbevraging;Aandeel van de inwoners dat tevreden is over de opvang van baby's en peuters.;persoon;procent;De tellers werden berekend op basis van 3 gegroepeerde antwoordcategorieën: 'Zeer ontevreden/eerder ontevreden', 'Niet tevreden, niet ontevreden', 'Eerder tevreden/Zeer tevreden'.;Iedereen die antwoordde op de vraag werd in de noemer opgenomen, uitgezonderd de respondenten in de categorie 'Weet niet/niet van toepassing'. Indien dit om een omvangrijke categorie gaat, wordt dit percentage meegegeven bij 'Opmerkingen bij de kwaliteit'.;Burgerbevraging Gemeente-Stadsmonitor, Agentschap Binnenlands Bestuur;2020;voorjaar 2024;Tevredenheid over kinderopvang;https://gsminfo.blob.core.windows.net/$web/Rapporten_outputs/OutputPerlDO/GSM_Extract_ZO_S_08.xlsx;Ben je tevreden over de voorzieningen in jouw gemeente/stad? Kinderopvang (0-3jaar). Antwoordmogelijkheden: 'Zeer ontevreden', 'Eerder ontevreden', 'Niet tevreden, niet ontevreden', 'Eerder tevreden', 'Zeer tevreden', 'Weet niet/niet van toepassing'
341;Zorg en gezondheid;Burgerbevraging;Aandeel van de inwoners dat tevreden is over de ouderenvoorzieningen.;persoon;procent;De tellers werden berekend op basis van 3 gegroepeerde antwoordcategorieën: 'Zeer ontevreden/eerder ontevreden', 'Niet tevreden, niet ontevreden', 'Eerder tevreden/Zeer tevreden'.;Iedereen die antwoordde op de vraag werd in de noemer opgenomen, uitgezonderd de respondenten in de categorie 'Weet niet/niet van toepassing'. Indien dit om een omvangrijke categorie gaat, wordt dit percentage meegegeven bij 'Opmerkingen bij de kwaliteit'.;Burgerbevraging Gemeente-Stadsmonitor, Agentschap Binnenlands Bestuur;2020;voorjaar 2024;Tevredenheid over ouderenvoorzieningen;https://gsminfo.blob.core.windows.net/$web/Rapporten_outputs/OutputPerlDO/GSM_Extract_ZO_S_09.xlsx;Ben je tevreden over de voorzieningen in jouw gemeente/stad? Ouderenvoorzieningen (ontmoetingscentrum, serviceflat, lokaal dienstencentrum,...). Antwoordmogelijkheden: 'Zeer ontevreden', 'Eerder ontevreden', 'Niet tevreden, niet ontevreden', 'Eerder tevreden', 'Zeer tevreden', 'Weet niet/niet van toepassing'
342;Zorg en gezondheid;Burgerbevraging;Aandeel van de inwoners dat vindt dat er voldoende huisartsen zijn in de de buurt.;persoon;procent;De tellers werden berekend op basis van 3 gegroepeerde antwoordcategorieën: 'Helemaal oneens/Eerder oneens', 'Niet eens, niet oneens' en 'Eerder eens/ Helemaal eens'.;Iedereen die antwoordde op de vraag werd in de noemer opgenomen, uitgezonderd de respondenten in de categorie 'Weet niet/niet van toepassing'. Indien dit om omvangrijke categorie gaat, wordt hun percentage meegegeven bij 'Opmerkingen bij de kwaliteit'.;Burgerbevraging Gemeente-Stadsmonitor, Agentschap Binnenlands Bestuur;2020;voorjaar 2024;Voldoende huisartsen;https://gsminfo.blob.core.windows.net/$web/Rapporten_outputs/OutputPerlDO/GSM_Extract_ZO_S_07.xlsx;Ben je het met onderstaande uitspraken over jouw buurt eens? Er zijn voldoende huisartsen in de buurt. Antwoordmogelijkheden: 'Helemaal oneens', 'Eerder oneens', 'Niet eens, niet oneens', 'Eerder eens', 'Helemaal eens', 'Weet niet/niet van toepassing'
343;Zorg en gezondheid;Burgerbevraging;Aandeel van de inwoners dat vindt dat er voldoende zorgvoorzieningen voor ouderen zijn in de buurt.;persoon;procent;De tellers werden berekend op basis van 3 gegroepeerde antwoordcategorieën: 'Helemaal oneens/Eerder oneens', 'Niet eens, niet oneens' en 'Eerder eens/ Helemaal eens'.;Iedereen die antwoordde op de vraag werd in de noemer opgenomen, uitgezonderd de respondenten in de categorie 'Weet niet/niet van toepassing'. Indien dit om omvangrijke categorie gaat, wordt hun percentage meegegeven bij 'Opmerkingen bij de kwaliteit'.;Burgerbevraging Gemeente-Stadsmonitor, Agentschap Binnenlands Bestuur;2020;voorjaar 2024;Voldoende zorgvoorzieningen voor ouderen;https://gsminfo.blob.core.windows.net/$web/Rapporten_outputs/OutputPerlDO/GSM_Extract_ZO_S_10.xlsx;Ben je het met onderstaande uitspraken over jouw gemeente/buurt eens? Er zijn voldoende ouderenvoorzieningen in mijn gemeente/buurt (een ontmoetingscentrum, serviceflat, lokaal dienstencentrum). Antwoordmogelijkheden: 'Helemaal oneens', 'Eerder oneens', 'Niet eens, niet oneens', 'Eerder eens', 'Helemaal eens', 'Weet niet/niet van toepassing'
344;Zorg en gezondheid;Geregistreerde statistiek;Aantal thuiswonende personen die een tegemoetkoming mantel- en thuiszorg van de Vlaamse zorgverzekering ontvangen, per 100 inwoners. De Vlaamse zorgverzekering betaalt een tegemoetkoming uit aan personen met een zwaar verminderd vermogen tot zelfzorg. In deze reeks nemen we enkel de personen die de mantel- en thuiszorgpremie ontvangen in aanmerking. Personen die een residentiële premie ontvangen worden immers gevat door de indicator over residentiële ouderenzorg.;rechthebbende;per 100 inwoners;Aantal ten lastenemingen in de zorgverzekering mantel- en thusizorg;Aantal inwoners;Vlaams Agentschap Zorg en Gezondheid;2021;mei 2023;Zorgbehoevenden met zorgverzekering mantel- en thuiszorg;https://gsminfo.blob.core.windows.net/$web/Rapporten_outputs/OutputPerlDO/GSM_Extract_ZO_16.xlsx;
345;Werk;Burgerbevraging;Aandeel van de inwoners die werkt/studeert in de eigen gemeente.;persoon;procent;De teller bevat iedereen die het meest werkt/studeert in de eigen gemeente inclusief diegenen die zich niet moeten verplaatsen.;De noemer bevat iedereen die werkt/studeert.;Burgerbevraging Gemeente-Stadsmonitor, Agentschap Binnenlands Bestuur;2020;voorjaar 2024;Werken in eigen gemeente;https://gsminfo.blob.core.windows.net/$web/Rapporten_outputs/OutputPerlDO/GSM_Extract_WE_S_01.xlsx;
346;Werk;Geregistreerde statistiek;De activiteitsgraad wordt berekend als het aandeel van de beroepsbevolking in de totale bevolking op arbeidsleeftijd (van 20 tot en met 64 jaar). Bij de totale bevolking op arbeidsleeftijd (van 20 tot en met 64 jaar) maakt men een onderscheid tussen de niet-beroepsactieve bevolking en de beroepsbevolking op arbeidsleeftijd. De niet-beroepsactieve bevolking bestaat uit die personen die niet werken, niet beschikbaar zijn voor een job en/of niet actief op zoek zijn naar een job. De beroepsbevolking bestaat uit diegenen die aan het werk zijn (werkenden) en zij die beschikbaar zijn voor een job en actief op zoek naar werk (niet-werkende werkzoekenden).;persoon/werkende;procent;Beroepsbevolking van 20 tot en met 64 jaar;Aantal inwoners van 20 tot en met 64 jaar;Steunpunt Werk - Vlaamse Arbeidsrekening o.b.v. RSZ, RSVZ, RIZIV, RVA, Statbel (Algemene Directie Statistiek – Statistics Belgium), DWH AM&SB bij de KSZ, BISA;2019;onbekend;Activiteitsgraad;https://gsminfo.blob.core.windows.net/$web/Rapporten_outputs/OutputPerlDO/GSM_Extract_WE_28.xlsx;
347;Integratie;Geregistreerde statistiek;"Aantal leerlingen dat in het gewoon lager onderwijs minstens 2 jaar schoolse vertraging heeft opgelopen en die wonen in de gemeente ten opzichte van het aantal leerlingen in het gewoon lager onderwijs die wonen in de gemeente, naar thuistaal.
De leerlingenaantallen hebben betrekking op de leerlingen die in de gemeente wonen, los van het feit of de leerlingen in de gemeente naar school gaan of elders. De cijfers voor de Brusselse gemeenten hebben enkel betrekking op de leerlingen ingeschreven in het Nederlandstalig onderwijs.
De thuistaal is niet het Nederlands als de leerling in het gezin met niemand of in een gezin met 3 gezinsleden (de leerling niet meegerekend) met maximum 1 gezinslid Nederlands spreekt. Broers en zussen worden als 1 gezinslid beschouwd.";leerling;procent;Aantal leerlingen dat in gewoon lager onderwijs minstens 2 jaar schoolse vertraging heeft opgelopen, naar thuistaal, wonend in de gemeente;Aantal leerlingen in het gewoon lager onderwijs, naar thuistaal, wonend in de gemeente;Departement Onderwijs & Vorming;2022;februari 2024;Schoolse vertraging lager onderwijs, naar woonplaats, naar thuistaal;https://gsminfo.blob.core.windows.net/$web/Rapporten_outputs/OutputPerlDO/GSM_Extract_ON_15.xlsx;
348;Integratie;Geregistreerde statistiek;"Aantal leerlingen dat in het gewoon secundair onderwijs minstens 2 jaar schoolse vertraging heeft opgelopen en die wonen in de gemeente ten opzichte van het aantal leerlingen in het gewoon secundair onderwijs die wonen in de gemeente, naar thuistaal.
De leerlingenaantallen hebben betrekking op de leerlingen die in de gemeente wonen, los van het feit of de leerlingen in de gemeente naar school gaan of elders. De cijfers voor de Brusselse gemeenten hebben enkel betrekking op de leerlingen ingeschreven in het Nederlandstalig onderwijs.
De thuistaal is niet het Nederlands als de leerling in het gezin met niemand of in een gezin met 3 gezinsleden (de leerling niet meegerekend) met maximum 1 gezinslid Nederlands spreekt. Broers en zussen worden als 1 gezinslid beschouwd.";leerling;procent;Aantal leerlingen dat in gewoon secundair onderwijs minstens 2 jaar schoolse vertraging heeft opgelopen, naar thuistaal, wonend in de gemeente;Aantal leerlingen in het gewoon secundair onderwijs, naar thuistaal, wonend in de gemeente;Departement Onderwijs & Vorming;2022;februari 2024;Schoolse vertraging secundair onderwijs, naar woonplaats, naar thuistaal;https://gsminfo.blob.core.windows.net/$web/Rapporten_outputs/OutputPerlDO/GSM_Extract_ON_27.xlsx;
349;Werk;Geregistreerde statistiek;De spanningsratio geeft aan hoeveel werkzoekenden zonder werk er beschikbaar zijn ten opzichte van het totaal aantal openstaande vacatures. De werkzoekenden zonder werk (WZW) zijn personen zonder job die zich bij de VDAB als werkzoekende hebben ingeschreven. De openstaande VDAB-vacatures tonen de stock (of voorraad) aan vacatures die op de laatste dag van de maand bij de VDAB uitstaan. Het gaat over vacatures uit het Normaal Economisch Circuit zonder Uitzendopdrachten die rechtstreeks aan de VDAB gemeld worden. De indicator geeft het gemiddelde over de maanden januari-december.;persoon/werkzoekende zonder werk;;Aantal werkzoekenden zonder werk;Aantal openstaande VDAB-vacatures;Vlaamse Dienst voor Arbeidsbemiddeling en Beroepsopleiding;2022;januari 2024;Spanningsratio;https://gsminfo.blob.core.windows.net/$web/Rapporten_outputs/OutputPerlDO/GSM_Extract_WE_29.xlsx;
350;Werk;Geregistreerde statistiek;De werkzaamheidsgraad wordt berekend als aandeel werkenden in de bevolking op arbeidsleeftijd (20-64 jaar). De werkenden bestaan uit alle personen die in de referentieperiode betaalde arbeid verricht hebben. Bij de totale bevolking (20-64 jaar) maakt men een onderscheid tussen de niet-beroepsactieve bevolking en de beroepsbevolking op arbeidsleeftijd. De niet-beroepsactieve bevolking bestaat uit die personen die niet werken, niet beschikbaar zijn voor een job en/of niet actief op zoek zijn naar een job. De beroepsbevolking bestaat uit diegenen die aan het werk zijn (werkenden) en zij die beschikbaar zijn voor een job en actief op zoek naar werk (niet-werkende werkzoekenden). Hier wordt de opsplitsing gemaakt naar geslacht.;persoon/werkende;procent;Aantal werkenden van 20 tot en met 64 jaar;Aantal inwoners van 20 tot en met 64 jaar;Steunpunt Werk - Vlaamse Arbeidsrekening o.b.v. RSZ, RSVZ, RIZIV, RVA, Statbel (Algemene Directie Statistiek – Statistics Belgium), DWH AM&SB bij de KSZ, BISA;2019;onbekend;Werkzaamheidsgraad, naar geslacht;https://gsminfo.blob.core.windows.net/$web/Rapporten_outputs/OutputPerlDO/GSM_Extract_WE_01.xlsx;
351;Werk;Geregistreerde statistiek;"De werkzoekenden zonder werk (WZW) zijn personen zonder job die zich bij de VDAB als werkzoekende hebben ingeschreven.
Als laaggeschoold worden deze personen beschouwd die ten hoogste een diploma lager onderwijs of 1ste graad van het secundair onderwijs, leertijd, deeltijds beroepssecundair onderwijs of 2de graad secundair onderwijs behaald hebben. Bij het aandeel laaggeschoolde werkzoekenden zonder werk wordt de verhouding tussen het aantal laaggeschoolde werkzoekenden zonder werk (15-64 jaar) en het totale aantal werkzoekenden zonder werk (15-64 jaar) genomen. 
Als middengeschoold worden deze personen beschouwd die ten hoogste een studiegetuigschrift van de derde graad beroepssecundair onderwijs (BSO), diploma 3de graad secundair onderwijs, diploma van het secundair na secundair (Se-N-Se), diploma van de 4de graad beroepssecundair onderwijs behaald hebben. Bij het aandeel middengeschoolde werkzoekenden zonder werk wordt de verhouding tussen het aantal middengeschoolde werkzoekenden zonder werk (15-64 jaar) en het totale aantal werkzoekenden zonder werk (15-64 jaar) genomen. 
Als hooggeschoold worden deze personen beschouwd die ten hoogste een diploma hoger beroepsonderwijs, professionele bachelor, academische bachelor, master behaald hebben. Bij het aandeel hooggeschoolde niet-werkende werkzoekenden wordt de verhouding tussen het aantal hooggeschoolde niet-werkende werkzoekenden (15-64 jaar) en het totale aantal niet-werkende werkzoekenden (15-64 jaar) genomen.";persoon/werkzoekende zonder werk;procent;Aantal werkzoekenden zonder werk van 15 tot en met 64 jaar, naar scholingsgraad;Aantal werkzoekenden zonder werk van 15 tot en met 64 jaar;Vlaamse Dienst voor Arbeidsbemiddeling en Beroepsopleiding;2022;januari 2024;Werkzoekenden zonder werk, naar scholingsgraad;https://gsminfo.blob.core.windows.net/$web/Rapporten_outputs/OutputPerlDO/GSM_Extract_WE_16.xlsx;
352;Werk;Geregistreerde statistiek;Bij de langdurige werkloosheid wordt er gekeken naar het aandeel langdurig werkzoekenden zonder werk (15-64 jaar) in de totale groep van werkzoekenden zonder werk (15-64 jaar). De werkzoekenden zonder werk (WZW) zijn personen zonder job die zich bij de VDAB als werkzoekende hebben ingeschreven. Langdurig werkzoekenden zonder werk  (15-64 jaar) zijn 1 jaar of langer werkzoekend.;persoon/werkzoekende zonder werk;procent;Aantal langdurig werkzoekenden zonder werk van 15 tot en met 64 jaar;Aantal werkzoekenden zonder werk van 15 tot en met 64 jaar;Vlaamse Dienst voor Arbeidsbemiddeling en Beroepsopleiding;2022;januari 2024;Langdurig werkzoekenden zonder werk;https://gsminfo.blob.core.windows.net/$web/Rapporten_outputs/OutputPerlDO/GSM_Extract_WE_20.xlsx;
353;Integratie;Geregistreerde statistiek;"Aantal jongeren die niet meer leerplichtig zijn en het Vlaams secundair onderwijs verlaten zonder kwalificatie en die wonen in de gemeente, naar thuistaal. Dat aantal wordt afgezet ten opzichte van de som van het aantal vroegtijdige schoolverlaters en het aantal leerlingen dat wel een kwalificatie heeft gehaald.
Een vroegtijdige schoolverlater is een leerling die niet langer leerplichtig is en die een regulier kwalificerend traject van het Vlaams secundair onderwijs verlaat zonder kwalificatie met een beroepsfinaliteit of een finaliteit doorstroom hoger onderwijs.
De cijfers voor de Brusselse gemeenten hebben enkel betrekking op de leerlingen ingeschreven in het Nederlandstalig onderwijs.
De thuistaal is niet het Nederlands als de leerling in het gezin met niemand of in een gezin met 3 gezinsleden (de leerling niet meegerekend) met maximum 1 gezinslid Nederlands spreekt. Broers en zussen worden als 1 gezinslid beschouwd.";jongere;procent;Aantal jongeren die niet meer leerplichtig zijn en Vlaams secundair onderwijs verlaten zonder kwalificatie, wonend in de gemeente, naar thuistaal;Aantal vroegtijdige schoolverlaters en aantal leerlingen dat wel kwalificatie heeft gehaald;Departement Onderwijs & Vorming;2021;maart 2024;Vroegtijdige schoolverlaters, naar woonplaats, naar thuistaal;https://gsminfo.blob.core.windows.net/$web/Rapporten_outputs/OutputPerlDO/GSM_Extract_ON_32.xlsx;
354;Integratie;Geregistreerde statistiek;"Aantal ingeschreven kiezers met vreemde nationaliteit ten opzichte van het aantal potentiële kiezers.
Personen die zich als kiezer hebben ingeschreven bij de gemeenteraadsverkiezingen: alle inwoners met een huidige vreemde (= niet-Belgische) nationaliteit die voor 1 augustus van het jaar van de verkiezingen een aanvraag om als gemeenteraadskiezer erkend te worden hebben ingediend bij het gemeentebestuur en die voldoen aan de voorwaarden van de wet van 19 maart 2004.
Potentiële kiezers: alle inwoners met een huidige vreemde (= niet-Belgische) nationaliteit. Bij de niet-EU-burgers gaat het enkel om diegenen die voldoen aan de voorwaarden van de wet van 19 maart 2004: onder meer minstens 5 jaar ononderbroken hoofdverblijfplaats in België.";persoon/kiezer;procent;Aantal personen dat zich als kiezer heeft ingeschreven;Aantal potentiële kiezers;Federale Overheidsdienst Binnenlandse Zaken;2018;oktober 2024;Bereik niet-Belgische kiezers;https://gsminfo.blob.core.windows.net/$web/Rapporten_outputs/OutputPerlDO/GSM_Extract_LO_29.xlsx;
355;Integratie;Geregistreerde statistiek;"Aantal ingeschreven kiezers met vreemde nationaliteit ten opzichte van het aantal potentiële kiezers per nationaliteitsgroep.
Personen die zich als kiezer hebben ingeschreven bij de gemeenteraadsverkiezingen: alle inwoners met een huidige vreemde (= niet-Belgische) nationaliteit die voor 1 augustus van het jaar van de verkiezingen een aanvraag om als gemeenteraadskiezer erkend te worden hebben ingediend bij het gemeentebestuur en die voldoen aan de voorwaarden van de wet van 19 maart 2004.
Potentiële kiezers: alle inwoners met een huidige vreemde (= niet-Belgische) nationaliteit. Bij de niet-EU-burgers gaat het enkel om diegenen die voldoen aan de voorwaarden van de wet van 19 maart 2004: onder meer minstens 5 jaar ononderbroken hoofdverblijfplaats in België.";persoon/kiezer;procent;Aantal personen dat zich als kiezer heeft ingeschreven per nationaliteitsgroep;Aantal potentiële kiezers per nationaliteitsgroep;Federale Overheidsdienst Binnenlandse Zaken;2018;oktober 2024;Bereik niet-Belgische kiezers, naar nationaliteit;https://gsminfo.blob.core.windows.net/$web/Rapporten_outputs/OutputPerlDO/GSM_Extract_LO_28.xlsx;
356;Integratie;Geregistreerde statistiek;"Aantal cursisten van het volwassenenonderwijs tijdens het refertejaar (van 1 april van jaar x tot 31 maart van jaar x+1) en die wonen in de gemeente, naar nationaliteitsgroep. Het gaat om de basiseducatie, het secundair volwassenenonderwijs, het hoger beroepsonderwijs van het volwassenenonderwijs en de specifieke lerarenopleiding. Het volwassenenonderwijs is onderwijs los van de initiële onderwijsloopbaan. Het stelt de cursisten in staat om een erkend diploma, getuigschrift of certificaat te behalen. Volwassenen van minimum 18 jaar en jongeren die aan de voltijdse leerplicht voldaan hebben, mogen zich inschrijven. Naargelang de gekozen cursus kunnen er ook specifieke toelatingsvoorwaarden zijn.
De aantallen hebben betrekking op de cursisten die in de gemeente wonen, los van het feit of zij in de gemeente onderwijs volgen of elders. De cijfers voor de Brusselse gemeenten hebben enkel betrekking op de cursisten ingeschreven in het Nederlandstalige volwassenenonderwijs.
De gegevens zijn opgesplitst naar nationaliteitsgroep op basis van de huidige nationaliteit van de cursist zoals meegedeeld door de instelling aan het Vlaams Ministerie Onderwijs en Vorming.";cursist;procent;Aantal cursisten volwassenenonderwijs per nationaliteitsgroep;Totaal aantal cursisten;Departement Onderwijs & Vorming;2021;oktober 2023;Deelnemers volwassenenonderwijs, naar nationaliteit, naar woonplaats;https://gsminfo.blob.core.windows.net/$web/Rapporten_outputs/OutputPerlDO/GSM_Extract_ON_37.xlsx;
357;Integratie;Geregistreerde statistiek;Aantal vreemdelingen (= personen met huidige vreemde nationaliteit) dat zich in de loop van het jaar vanuit het buitenland in de gemeente is komen vestigen + aantal vreemdelingen dat werd overgeschreven van het wachtregister naar een regulier bevolkingsregister + aantal vreemdelingen dat in een regulier bevolkingsregister werd heringeschreven na eerder te zijn geschrapt.;migratie;per 1.000 inwoners;Aantal inwijkingen van vreemdelingen uit het buitenland;Aantal inwoners;Statbel;2022;juli 2024;Externe inwijking van vreemdelingen;https://gsminfo.blob.core.windows.net/$web/Rapporten_outputs/OutputPerlDO/GSM_Extract_DE_28.xlsx;
358;Integratie;Geregistreerde statistiek;"Aantal vreemdelingen (= personen met huidige vreemde nationaliteit) dat in de loop van het jaar is uitgeweken naar het buitenland + aantal vreemdelingen dat werd overgeschreven van een regulier bevolkingsregister naar het wachtregister + aantal vreemdelingen dat uit een regulier bevolkingsregister werd geschrapt
Saldo internationale migraties = internationale inwijking - internationale uitwijking.";migratie;per 1.000 inwoners;Aantal uitwijkingen van vreemdelingen naar het buitenland;Aantal inwoners;Statbel;2022;juli 2024;Externe uitwijking van vreemdelingen;https://gsminfo.blob.core.windows.net/$web/Rapporten_outputs/OutputPerlDO/GSM_Extract_DE_29.xlsx;
359;Integratie;Geregistreerde statistiek;"Aantal huurders van een sociale woning per nationaliteitsgroep en aandeel van de huurders in het totaal aantal inwoners per nationaliteitsgroep. Het gaat om het aantal unieke huurders op het einde van het jaar. Dat wordt afgezet ten opzichte van het totaal aantal inwoners per nationaliteitsgroep op 1 januari van het volgende jaar.
Volgende nationaliteitsgroepen worden gebruikt:
- België: personen met een huidige Belgische nationaliteit
- EU-burgers (zonder België): personen met een huidige niet-Belgische EU-nationaliteit
- niet-EU-burgers: personen met een huidige niet-EU-nationaliteit.";persoon/huurder;procent;Aantal huurders per nationaliteitsgroep;Aantal inwoners per nationaliteitsgroep;Vlaamse Maatschappij voor Sociaal Wonen;2021;augustus 2023;Huurders van sociale woning, naar nationaliteit;https://gsminfo.blob.core.windows.net/$web/Rapporten_outputs/OutputPerlDO/GSM_Extract_WO_12.xlsx;
360;Integratie;Geregistreerde statistiek;Aantal meerderjarige inburgeraars dat zich in de loop van het jaar voor het eerst heeft aangemeld bij een onthaalbureau. Personen die behoren tot de verplichte doelgroep van het Vlaamse inburgeringsbeleid moeten zich binnen een termijn van maximaal drie maanden vanaf het moment waarop hun inburgeringsplicht is ontstaan bij een onthaalbureau aanmelden. Ook personen die recht hebben op een inburgeringstraject kunnen zich vrijwillig bij een onthaalbureau aanmelden. Samen met de betrokkene bekijkt het onthaalbureau wat het inburgeringstraject zal inhouden. Afhankelijk van de situatie van de betrokkene bestaat een inburgeringstraject uit een basiscursus Nederlands, een cursus maatschappelijke oriëntatie en/of loopbaanoriëntatie. De nieuwkomer wordt verwacht op regelmatige basis de lessen te volgen, zoniet kan hij administratief gesanctioneerd worden.;inburgeraar;per 10.000 inwoners;Aantal inburgeraars die zich hebben aangemeld bij een onthaalbureau;Aantal inwoners;Agentschap Binnenlands Bestuur, Kruispuntbank Inburgering;2020;juni 2023;Inburgeraars aangemeld bij onthaalbureau;https://gsminfo.blob.core.windows.net/$web/Rapporten_outputs/OutputPerlDO/GSM_Extract_DE_61.xlsx;
361;Integratie;Geregistreerde statistiek;"Aantal meerderjarige inburgeraars dat zich in de loop van het jaar voor het eerst heeft aangemeld bij een onthaalbureau. Personen die behoren tot de verplichte doelgroep van het Vlaamse inburgeringsbeleid moeten zich binnen een termijn van maximaal drie maanden vanaf het moment waarop hun inburgeringsplicht is ontstaan bij een onthaalbureau aanmelden. Ook personen die recht hebben op een inburgeringstraject kunnen zich vrijwillig bij een onthaalbureau aanmelden. Samen met de betrokkene bekijkt het onthaalbureau wat het inburgeringstraject zal inhouden. Afhankelijk van de situatie van de betrokkene bestaat een inburgeringstraject uit een basiscursus Nederlands, een cursus maatschappelijke oriëntatie en/of loopbaanoriëntatie. De nieuwkomer wordt verwacht op regelmatige basis de lessen te volgen, zoniet kan hij administratief gesanctioneerd worden.
De cijfers over het aantal inburgeraars dat zich aanmeldt, zijn opgesplitst naar doelgroep. De doelgroep houdt verband met het feit dat bepaalde categorieën inburgeraars verplicht zijn om een inburgeringstraject te volgen en anderen niet.";inburgeraar;procent;Aantal inburgeraars die zich hebben aangemeld bij een onthaalbureau naar doelgroep;Aantal inburgeraars die zich hebben aangemeld bij een onthaalbureau;Agentschap Binnenlands Bestuur, Kruispuntbank Inburgering;2020;juni 2023;Inburgeraars aangemeld bij onthaalbureau, naar doelgroep;https://gsminfo.blob.core.windows.net/$web/Rapporten_outputs/OutputPerlDO/GSM_Extract_DE_62.xlsx;
